{
  "derived_model_version": "0.1.0",
  "artifact_type": "GuidanceFamily",
  "regulator_profile": "ich",
  "records": [
    {
      "guidance_family_id": "fixture.family.ich_m10",
      "family_title": "ICH M10",
      "regulator_profile": "ich",
      "jurisdictions": ["ICH"],
      "current_risk_assessment_id": null,
      "review_status": "needs_review",
      "profile_details": null
    }
  ]
}
